'신의 손' 마라도나, 60년 드리블 마치고 신의 곁으로	2020.11.26. 오전 7:17	심장마비로 별세···향년 60세 /연합뉴스  [서울경제] 아르헨티나 출신의 전설적인 축구선수 디에고 마라도나가 25일(현지시간) 심장마비로 별세했다. 향년 60세.  클라린, 라나시온 등 아르헨티나 언론들은 마라도나가 이날 오후 수도 부에노스아이레스 근교 티그레의 자택에서 숨졌다고 전했다. 마라도나는 지난 3일 경막하혈종으로 뇌 수술을 받고 통원 치료를 받으며 회복 중이었다.당시 주치의는 수술이 성공적이었다고 말한 바 있다. 라나시온은 이날 마라도나가 심장마비 후 9대의 구급차가 도착했을 때는 이미 숨진 뒤였다고 보도했다. 로이터통신은 고인의 변호인을 인용해 사인이 심장마비라고 전했다.  등번호 10번의 마라도나는 아르헨티나 축구 전설이자 영웅이다. 브라질의 펠레와 더불어 전 세계에서 가장 위대한 축구 선수 중 한 명으로 꼽힌다. 마라도나는 1960년 아르헨티나 부에노스아이레스주에서 태어나 1976년 아르헨티노스 주니어스에서 프로에 데뷔했으며, 아르헨티나 보카 주니어스, 스페인의 FC바르셀로나, 이탈리아 나폴리 등을 거쳤다. 작지만 단단한 몸에 화려한 드리블, 위력적인 왼발 킥으로 그라운드를 평정했다. 일찌감치 아르헨티나 국가대표 유니폼을 입고 A매치 91경기에 출전해 34골을 넣었다.  특히 1986년 멕시코 월드컵에서 아르헨티나의 우승을 이끌며 일약 국민영웅이 됐다. 당시 잉글랜드의와 8강에서 헤더하는 것처럼 왼손으로 골을 넣어 ‘신의 손’이라는 이름을 얻었다. 축구 역사에서 가장 유명한 장면 중 하나로 꼽힌다.  ‘악동’이라는 수식어가 따라다닌 마라도나에겐 약물 스캔들도 이어졌다. 1994년 미국 월드컵 도중 도핑 테스트에 적발돼 중도 귀국해야 했고 마약 중독 치료도 몇 차례 받았다. 마약과 알코올 복용, 비만 등으로 과거에도 심장 문제를 겪는 등 건강상태가 좋지 않았다.  이런저런 기행이나 문제적인 발언들로 언론의 헤드라인을 장식하고 사생활을 둘러싸고도 말들이 나왔지만, 이같은 논란 속에서도 천재적인 재능을 바탕으로 한 축구 실력에 대해서는 논란이 없었다.  축구 전설의 별세 소식에 아르헨티나와 전 세계 축구계가 슬픔에 빠졌다. 알베르토 페르난데스 아르헨티나 대통령은 3일간의 국가 애도 기간을 선포했다. 리오넬 메시와 디에고 마라도나. /EPA연합뉴스  브라질 펠레는 “분명히 언젠가 하늘에서 우리가 함께 공을 차게 될 것”이라고 애도했고 고인이 몸 담았던 팀 나폴리도 작별을 전했다. 아르헨티나 출신인 리오넬 메시(FC바르셀로나)는 트위터에 고인의 사진을 올리며 “전설이여 안녕”이라고 작별을 전했다. 메시는 “아르헨티나 국민과 축구계에 매우 슬픈 날”이라며 “그는 우리를 떠나지만 떠나지 않는 것이기도 하다. 디에고는 영원하기 때문”이라고 썼다.  이날 유럽축구연맹(UEFA) 챔피언스리그 경기에 앞서 고인을 추모하는 시간도 마련될 예정이다. /김민혁기자 minegi@sedaily.com  ▶ '3분'만 투자하세요 [김영필의 월스트리트] ▶ 정치권 속사정이 궁금하다면 [여쏙야쏙] ▶ 네이버 채널에서 '서울경제' 구독해주세요!   저작권자 ⓒ 서울경제, 무단 전재 및 재배포 금지	
1	고인의 명복을 빕니다그리고 스포츠계 댓글 좀달게 바꾸어라	6.584962500721156	3.9068905956085187	7
1	ㅇㅈ.. 요즘 스포츠뉴스는 댓글을 못보니 재미가 없어서 안들어가게됨	1.5849625007211563	1.0
1	해축 한해서만 열고 e스포츠만 댓글 잠그면 될듯... 그쪽이 가장 덧글이 더러운데 선수들은 어리다보니 상처받기도 쉬워서 e스포츠만큼은 덧글 열면 안 됨. 해축은 해외선수들이 네이버 보지도 않으니 그나마 상관없겠지만...	2.321928094887362	0
1	점점 공산주의 사회주의 빨갱이 시상을 만들어야 해서 댓글 다 차단할겁니다 그 시작이 스포츠	1.5849625007211563	1.0
1	아니 댓글 폐지보다 악플 신고 먹은애들을 관리를 해야지ㅋㅋ 자살 한다고 옥상 문 잠궈서 불나서 죽는 꼴 나고있다니까? 이상한 기사, 클릭 유도성 기사,제일 위험한 허위 기사가 점점 극 암적으로 늘어나는데 댓글로 안 알려주면 그대로 믿는 사람들 100퍼 생김.	2.321928094887362	0
1	개소리하네 툭하면 맨유리버풀 가지고 어그로만 존나끌면서  댓글을 열긴 뭘열어ㅋㅋㅋ	0.0	0.0
1	근원맨 같은 새X들 있어서 절대 열면 안 됨	0	0
2	원래 일본월드컵이였는데 마라도나가 힘써준덕에 한일월드컵으로 바꼈지.. 고인의 명복을빕니다	5.321928094887363	0.0	3
2	마라도나가 86월드컵때 허접무의 슈퍼킥이랑 50여년만에 월드컵 무대를 밟은 대한민국의 경기력을 인상깊게봤다고 내 뇌피셜로 국뽕 쳐맞고 발광해본다	1.0	0.0
2	브라질과 친한 일본이 월드컵 유치되도록 힘을 쓰니 브라질을 ㅈㄴ 싫어하는 우루과이랑 아르헨티나가 엿먹으라고 한국을 밀어줬음.	3.4594316186372978	0
3	마라도나보다 먼저 가야할 사람은 여럿있는데....저승사자가 잘 못 고른듯.....	4.754887502163469	1.5849625007211563	7
3	윤짜장	1.0	3.700439718141092
3	쭵쭵	2.0	1.0
3	애미추	2.0	0
3	재앙	1.0	1.5849625007211563
3	문라도나?	1.0	0.0
3	좆국	0	0
3	문재인,조국,추미애,시진핑,푸틴,김정은,이인영,박능후,정은경,노영민,이재명,이낙연	0	0.0
4	늘 논란의 중심에 있었던 악동..rest in peace.	3.5849625007211565	2.0	0
5	제목이 저게 뭐냐	1.5849625007211563	0	0
6	즐거웠어요.감사합니다.좋은곳 편히쉬세요	1.5849625007211563	0	0
7	재앙을 몰고오는 놈은  안죽고 엉뚱햔  놈이 죽는구나.	2.807354922057604	2.321928094887362	0
8	저번 월드컵때 쌍뻐큐 날리고 정정해보였는데 .. 아쉽...	1.0	0	0
9	당장 가야할 문재앙 추미애 조국 이런 놈들은 안가고.. 에휴.. 테스형!!! 얼른 쟤네들좀 데려가!	1.5849625007211563	1.0	0
10	신의곁은 얼어죽을 ..	0.0	0	0
11	위대한 손을 주신 신께 돌아갔군요	0.0	0	0
12	유명한 사람들도 때가되면 하늘로 간다ㆍ백년 살것처럼 나대지말라 ㆍ지난날 팔팔하든 그 체력은 어디로 갔나ㆍ고인의 명복을  빕니다ㆍ	0.0	0	0
13	김정남 선수가 마라도나 막을려고 태권축구 생각나네요.사람은 모르겠으나 축구차원에선 영웅 맞죠	0.0	0	0
14	왜이리 일찍 가시는건가요.고인의 명복을 빌어드립니다	0.0	0	0
15	더 추잡한꼴 보이지 않고 전설로 남게되어 다행..	3.4594316186372978	3.4594316186372978	1
15	니도 참 말하는거 보니 인성이 OOO구나.	0	0
16	저리사는것도 나쁘지않은듯굵고 짧게... 60세이후로 기력없고 돈도없고 70세넘어서는 병들어서 수년간 골골하기보단 저리만산다면 80 90생과 바꿀의향있다	2.0	2.0	2
16	59.9세 되면 무일푼이어도 좋으니 박스라도 줍고 오래 살게 해주십쇼 하며 냉수 떠놓고 싹싹빌걸	0.0	0
16	ㄴ시바 ㅋㅋㅋㅋㅋㅋㅋㅋㅋ	0	0
17	고인의 명복을 빕니다. 엄청난 발재간과 축구실력을 가지고 신체적 조건이 열악한데도 세계 최고의 축구선수로 거듭난건 엄청난 노력이 있었을 겁니다.	0.0	0.0	0
18	60살이면 요즘은 한창 나이로 보던데..펠레와더불어 추구의 최고봉이었는데. 이제 60살에 심장마비.,..허무하네.,..에휴..	0	0	0
19	마라도나는 혹시 마라탕 좋아했나???????............  죄송합니다~~ ㅋㅋㅋㅋㅋㅋㅋㅋㅋㅋㅋㅋㅋㅋㅋㅋ	0	0	0
20	문재앙 10세기 심장은 우째 그리 박자맞춰 잘 뛰냐? 멈추지도 않고? 이놈 요즘 얼굴 보면. 아집과 교만에 사로잡혀서 뭔가 붓기도 띵띵하고 눈빛도 흐리멍텅함... 맛간듯	0	0	0
21	마 라도 나	0	0	0
22	미궄윌드컵때 허정무의 태권킥 맞고 뇌에 충격이 와서 악화된거 아녀?? 즉각 조사가 필요하다! ㅠ	0	0	0
23	펠레는 아직 살아있다	0	0	0
24	인종차별주의자 새끼잘가라축구도 마약 존나 빨고 했을 듯	0	0	0
25	삼가 고인의 명복을 빕니다.	0	0	0
26	참 파란만장한 삶을 살다 가시는구나~	0	0	0
27	신의손? 멕이는건가	0	0	1
27	뭘 맥여 ㅋㅋㅋ본인이 인정한거고 아무렇지 않아 했는데	0	0
28	심장마비는 근육이 쥐나는 원리랑 비슷해서, 주변에 사람만 있으면 재빠르게 CPR해주면 거의 회생하던데...혼자였나...	0	0	0
29	신들이 축구할려고 데려간듯 ㅜㅜ	0	0	0
30	여자로 드리들 그리 했으니 단명해도 변병의 여지가 없다~보고 있냐? 재앙아?	0	0	0
31	전설 마라도나 고인의 명복을빕니다	0	0	0
32	hands od god	0	0	0
33	어제 새벽에 디에고 라는 마라도나의 일대기를 그린 다큐영화를 케이블 채널에서 봤는데 진짜 대단한 선수더군. 당시 아르헨의 축구 영웅이었더군. 그런데 너무 최고가 되다보니 주위에서 마라도나를 가만 두지 않더군. 결국 이태리 세리에 리그에서 뛰면서 마약 조직의 마약의 유혹에 넘어가 나중에 쉽게 축구 인생을 마감하더군. 짧고 굵게 살다간 도나형 ~	0	0	0
34	마라도나가 팔딱거리며 돌아다닌게 어제같은데... 겨우 60세에 뒤지다니... 허무하다...	0	0	2
34	말하는게 상스러우시네ㅋㅋㅋㅋㅋ	1.0	0
34	고인에대한 예의가 아니지 ᆢ	0	0
35	신의 곁으로 ㅋㅋㅋㅋㅋㅋㅋㅋㅋ	0	0	0
36	축구계의 신의손 영원히 안~녕	0	0	0
37	그와중에 신의손ㅋ 삼가 고인의 명복을 빕니다	0	0	0
38	기자가 안티네..  신의손	0	0	0
39	마약왕 로이더	0	0	0
40	신의손이라니 키보드워리어같은새기야	0	0	0
41	우리나라 관중한테 욕할때는 미웠는데~~그래도 전설이라  불러드리겠어요 편히 쉬셔요~~	0	0	0
42	아르헨티나의 고종수라 불렸던 사나이...	0.0	1.0	0
42	아재? 할배? 그나이먹도록 참 ㅋ 니 어찌 사는지 다 보인다ㅋ	0	0
43	고인의 명복을 빕니다별이되어 더 빛나길🙏🙏	0	0.0	1
44	반헤일런도 글코 천재들은 단명하는가 보군	0	0.0	0
45	손으로 꼴넣은 놈 반성안하더라 치사한놈	0	1.0	0
46	젊은애인 만족시켜주려 비아그라 폭풍흡입한게 문제지	0	1.0	0
46	펠레겠죠 빡통 대ㄱ리 ㅂ신님아	0	0
46	펠레의 ㅈㅓ주 인데요	2.321928094887362	0
46	축알못 ㅡㅋㅋㅋㅋㅋㅋㅋㅋ	0	0
