트럼프에 '해고 통보' 받았지만... 화려한 복귀 기대되는 그들	2020.11.26. 오후 5:41	유엔 대사로 돌아 온 토마스그린필드처럼  해고 당했던 샐리 예이츠, 법무장관 1순위 탄핵 불리 발언했다 쫓겨난 국방·외교 인사도 샐리 예이츠 전 미국 법무장관 대행이 지난 8월 18일 민주당 전당대회 화상연설에 나서 도널드 트럼프 대통령의 실정을 고발하고 있다. 로이터 연합뉴스   도널드 트럼프 미국 대통령에게 쫓겨났던 '그들'이 공직으로 돌아올까. 조 바이든 차기 행정부 조각 작업이 본격화하면서 트럼프에게 해고 통보를 받았던 인물들이 하나 둘씩 다시 주목받기 시작했다. 미국 CNN방송은 25일(현지시간) 이런 인사들을 '트럼프 행정부의 피난민들'이라고 칭했다. 유엔 주재 대사로 외교가로 돌아온 린다 토마스그린필드 전 국무부 차관보가 '피난민' 복귀의 신호탄으로 읽힌다. 방송은 "특히 국가안보, 법집행, 외교 등의 분야에서 트럼프에 대한 충성심 부족과 같은 이유로 배척 당했으나 바이든 체제 아래 정부로 돌아올 만한 사람들이 많다"고 전했다.  가장 유력한 인물은 샐리 예이츠 전 법무부 장관 대행이다. 일간 워싱턴포스트는 "대부분의 민주당원과 전 법무부 관리들이 모두 인정한 유력 법무장관 후보"로 예이츠를 꼽고 있다. 버락 오바마 행정부 인사로 트럼프 행정부 출범 직후 대행을 맡은 예이츠는 2017년 법무부 직원들에게 트럼프의 '이슬람 국가 입국금지 행정명령' 관련 소송에서 정부를 변호하지 말라고 지시해 결국 경질됐다. 예이츠는 지난 8월 민주당 화상 전당대회에서 "트럼프 대통령이 법무부를 무기화에 법치를 짓밟고 사익을 보호하려고 했다"며 비판을 쏟아내 관심을 받기도 했다.  마리 요바노비치 전 우크라이나주재 미국 대사가 지난 2월 12일 워싱턴 조지타운대학에서 연설을 하고 있다. 워싱턴=AP 연합뉴스   외교·국방 분야에는 트럼프 탄핵 심판 사건과 연관된 인물들의 복귀 여부가 주목받고 있다. 트럼프 탄핵소추안 발의의 결정적 계기였던 '우크라이나 스캔들'이 터지기 직전인 지난해 5월 해임된 마리 요바노비치 전 우크라이나 주재 대사가 대표적이다. 탄핵 심판 과정에서 트럼프가 우크라이나 정부를 압박하는 과정에 동조하지 않은 게 요바노비치의 해임 이유로 알려졌다. 지난 1월 국무부에서 은퇴한 요바노비치는 조지 W 부시·오바마 행정부에서 모두 일한 경험 등이 높게 평가받고 있다.  알렉산더 빈드먼 전 육군 중령도 다시 관심을 받고 있다. 빈드먼은 우크라이나 스캔들로 불거진 트럼프 대통령과 볼로디미르 젤렌스키 우크라이나 대통령의 전화통화를 직접 들은 인물이다. 청문회에서 이 통화가 부적절하다는 소신 발언을 해 트럼프에게 미운털이 박혔고, 탄핵 위기에 벗어난 트럼프 대통령은 바로 그를 백악관 국가안전보장회의(NSC) 유럽담당 국장에서 해임했다.   지난해 11월 19일 의회에 출석한 알렉산더 빈드먼 전 육군 중령이 증언대에 오르기 전 선서를 하고 있다. 워싱턴=AP 연합뉴스   이 밖에도 최근 경질된 보니 글릭 전 국제개발처(USAID) 부처장과 크리스 크렙스 국토안보부 산하 사이버안보·인프라안보국(CISA) 국장도 바이든 행정부에서 재기가 기대되는 인물로 거론된다. 모두 대선 불복 행보를 이어 온 트럼프 대통령이 충성파 인사만 남기는 인사를 강행하면서 쫓겨난 이들이다. 특히 크렙스 국장은 트럼프가 주장한 부정선거 의혹과 관련 "표가 삭제되거나, 없어지거나, 바뀌거나 어떤 방식으로든 손상됐다는 증거는 없다"고 성명을 낸 후 트럼프의 해임 통보를 받았다.  진달래 기자 aza@hankookilbo.com    ▶ 네이버 채널에서 한국일보를 구독하세요! ▶ [오은영희 화해] 남편이 데리고 온 아들 생각에...이혼 뒤 한 집 살림 ▶ 한국일보닷컴 바로가기	
1	오바마가 정권 이양하면서 트럼프 말 제일 안들을 애들 심어 놓고 갔으니 쫓겨나는게 당연한거 아님? 트럼프와 반대하는 사람들이 결국 무슨 일을 저질렀을까? 특히 이번에 CIA랑 FBI국장 봐라 안 쫓아 냈더니 결국 나라의 선거에 외세와 좌파권력이 개입하도록 내버려뒀잖아.	5.554588851677638	4.523561956057013	4
1	전임 cia국장이 지금  국무장관인  폼페이오다.즉슨 현 국장은 트럼프가 임명한 거고...그리고 당신이나 나나 언론 통해서 줏어들은 얇다앏은 지식아닌 지식으로 좌파니 외세니 하는데 미국정치세계를 뭘 알겠노.흔히 한국에서는 좌파라 하면 빨갱이로 치부하드라만  우가 맞고 좌는 틀리다에서 벗어나라. 나는  내 자신이 좌인지 우인지도 모른다만...	3.8073549220576037	0
1	멍청하긴 그러니까 우파가 맨날 팩트싸움에서 쳐발리는거지 cia 국장이 가장 트럼프말 안듣는사람????  폼페이오는 뭐임???  어이없네..틀딱들은 아가리쫌 싸물면 좋겠다. 미국 상황 알지도 못하면서 우파코인 놈들한테 돈주는게 직업이면 관두길 바란다	0	0
1	본인이 주장하는 바가 좌파 선동가 김어준과 똑같이 트럼프 빠돌이 짓이란건 아슈?   대깨문인가?	0	0
1	무식한건가??  죄다 트럼프가 임명한 사람들인데요??  심지어 바른말하거나 자기말 안들으면 그마저도 짜르고 다른사람 앉힘.	0	0
2	오바마가 지 나가기전 되도안한것들  죄다 임명해놓고가는 만행을 저질러서 트럼프가 얼마나 열받았을지 이해가 가네.... 저런것들 바이든정권에 나온다고 풉! 감방에나 같이 가라고해라 ㅋㅋㅋ	4.584962500721157	3.0	2
2	폼페이오 어리둥절.... 존볼턴 어리둥절...	1.0	0
2	대통령 4년동안 얼마나 많은 사람들을 짜르고 새로 임명하고 그리고 또 짜르고 임명하고.....  다 자기편으로만 앉혀놓은게 누군데.... 심지어 그래놓고도 나중에 바른소리하거나 자기편 안들아주면 짜름.	0	0
3	바사모 짓 좀 그만하라고 ㅋㅋㅋㅋ 무슨 언론이 전부 바사모야 ㅋㅋㅋ	4.321928094887363	3.1699250014423126	4
3	이미 끝난 게임인데.... 이런 서런들이 모인게 우리나라 보수니까 태통령이 탐탁치 않은 데도 지지를 못받지. .	2.321928094887362	0.0
3	어떻게 댓글은 하나같이 다 트사모일까? 진짜 네이버댓글이 국민 여론을 하나도 반영 안한다는걸 통감하네	0.0	1.0
3	그게 팩트라서 라구요 이 불쌍한 사람아ㅠㅠㅠㅠ 진짜 정신승리 안쓰럽.....대체 이게 뭘 위한 정신승리인지도 모르겠어서 더 안쓰럽....	0.0	0
3	그냥 정신없는놈	0	0
4	그래게요 소 새끼도 아니고  카피기사질 만하는  무능한 기사질  그만좀	4.321928094887363	3.4594316186372978	0
5	달래씨 요즘 수당 엄청 퍼주니까 지금이라도 퇴사합시다 ㅋㅋㅋ 위에서 미친듯이 시키니까 본인도 올리기 싫은데 하는거죠?	3.4594316186372978	2.584962500721156	2
5	닥쳐. 괜히 성실히 일하고 있는 기자한테 시비걸지말고 나랑 만나서 맞짱한번 뜰래? 나 수구골통 태극기 부대 줘패기 전문인데.	0.0	0
5	ㅋㅋㅋ 위에서 시키는 데로 기사 올리기 있기 없기?	0	0
6	실컷 지명해라 어짜피 되지도 않고 만들 수도 없는 바이든행정부인데 지명놀이라도 해야지 근데 지명된 인사들 나중에 발뺌하는 변명이 몇 페이지 나올지 궁금하다 어떤식의 선긋기 속출일까?	2.0	0	0
7	바이든 펜실베니아  부정선거로  공청회 보셨나요?    수많은 중인들의  공청회 중언들....	3.5849625007211565	3.1699250014423126	0
8	근데 방구석에서 유튜브만보는 할배들이 바이든 감옥가고 트럼프 대통령된다던데 이거 언제 실현되나요?	1.5849625007211563	0.0	0
9	또다른 영어모르는 씨엔엔만 주구장창 보는 기자나왔네	1.5849625007211563	0.0	0
10	미국소식이랑 한국소식이 왜이리 다를까	1.0	0	0
11	기자야 외국방송좀.보고 기사써라씨엔엔만 보지말고 . .	1.0	0	0
12	기자님~ 지금 미국 돌아가는 상황을 좀더 깊이 연구하시고  기사내심 좋겠어요 외국기사 받아쓰기만 하지 마시구요	4.321928094887363	4.247927513443585	2
12	웃기고있네 그런 너는 미국정부에서 일하고 있냐?	1.0	0.0
12	미국 상황이 어떤데? 말좀해봐라	0.0	0
13	오늘 펜실바니아 법원에서  펜실바니아 주지사가 선언한 당선인증을 취소하라는 명령을 내렸다고 하네요. 민주당의 선거부정이 너무심하다는데, 우리언론은 좀 기다려보는 것이 좋을것 같아요	3.1699250014423126	3.0	1
13	이런 기사는 어디서 보시나요? 도통 한국에서는 알 수 없으니.	0	0
14	진달래기자님일이주 뒤엔 어떤글을 쓰실지 궁금해요	1.0	0.0	0
15	기자들 대부분이 기사 보도를 붙여넣기 방식으로 보도 재래식 보도를 고쳐서기자답게 보도해야 될것으로 생각되는 부분임.	1.0	0.0	0
16	응 됐고 화려한 복귀가 될지는 두고봐야 아는거 아니냐.. 아직 대규모 소송중이다..부정선거 자료가 넘쳐나더만..어제는 중국에서 만들어준 가짜 투표지 5백만장 동영상 자료도 나왔더라..점점 재미있어지네.. 밤잠 설칠 인간들 많겠네.	0.0	0	0
17	돈 엄청받았군..	0.0	0	0
18	뭘 화려하게 돌아와. 오늘 펜실베니아 청문회 때 그냥 부정선거 빼박 증인들 줄섰던데. 누가봐도 빼박 부정선거. 그냥 다함께 감옥 갈팀 꾸리는거지.	1.0	1.0	1
18	정신병이 중증이시네	0	0
19	감옥가겠지	0	0	0
20	이 기사 쓰신 기자님  알아보고쓰신거맞죠?	0	0	0
21	보수가 하도 치매걸린 틀니처럼 행동해서 문재인이 ㅈ같이 행동해도 지지를 못받잖냐.	0	0	0
22	트럼프의 악질손질이다일반직은 손안대는것이 를이다	0	0	0
23	There are lots of members who commit reply fabrication	0	0	0
24	트럼프나 바이든이나..좀 새로운 인물을 발탁해라	0	0	0
25	우리도 빨리 정상의 국가가 되어야하는데ㅜㅜ	0	0.0	1
26	우리나라 법무부 장관과 비교된다 같은 여자인데 참 저렇게 다르다니...누구는 소신대로 누구는 권력에 빌붙어서....	0	0.0	0
27	가짜뉴스 같은 헛소리 하는 보수가 부끄럽다. 대깨문보다 더 역겹다. 이나라는 답이없다.	0	0.0	0
28	쇼한다	0	0.0	0
29	스파이들 ~~~	0	0.0	0
30	트럼프는 선거방해를 결정하고하는짖이다미국억사에 트럼프 같은자  없다	0	1.0	0
